Initials,rental_link,rental_company,city,text_prompt,text_stimuli (title),text_stimuli,text_type,text_word_count,gAI_system_texts,reword,place_prompt,place_stimuli,place_type,gAI_system_places,face_stimuli,face_type,gAI_system_faces,ai_score,listing_type,features
,link ,AirBnb,"Spokane Valley, WA",NA,"Huge Home, Pool Table, Hot Tub","Located in a prestigious neighborhood, this fully updated home boasts 4000 sq. ft. of living space, comfortably accommodating 16. Unwind and de-stress with the hot tub, 4 smart TV's, fire pit, and city views. Enjoy a game of pool, foosball, or a round on the Pac-Man arcade. A home gym & nearby trails await the active enthusiast. Loaded to the max with amenities this escape offers the perfect blend of entertainment and comfort.
",Human,72,NA,NA,NA,stimuli/Human/human_places_intervention_20/human_spokanevalley.jpg,Human,NA,stimuli/Human/human_faces_intervention_20/16.R.SA.M.png,Human,NA,1.2,Human,multifeatured
TM,NA,NA,"San Bernardino, CA","Create and describe in 75 words a unique vacation rental in San Bernardino, CA with the title "" Downtown Redlands Historic Wonderland "" including a detail about the location.",Downtown Redlands Historic Wonderland ,"Nestled in the heart of historic Redlands, just two blocks from the iconic Redlands Bowl amphitheater, this restored 1920s Craftsman bungalow exudes California charm. The three-bedroom home features period details, including built-in cabinets and original windows, alongside modern amenities. A wraparound porch and citrus-filled backyard offer perfect spots to enjoy the year-round Mediterranean climate. Walking distance to State Street's boutiques, cafes, and the historic A.K. Smiley Public Library. Easy access to mountain trails and San Bernardino National Forest.",AI,78,Claude,Yes,"Create an image of the front view of the described vacation rental listing: Downtown Redlands Historic Wonderland nestles in the heart of Redlands' historic district, mere steps from the celebrated Fox Theater and vibrant State Street corridor. This meticulously maintained 1920s Craftsman showcases period charm while offering modern comfort. Located in a tree-lined neighborhood, guests can stroll to artisanal coffee shops, boutique shopping, and the popular farmers' market, yet enjoy serene surroundings in this historic enclave.",stimuli/AI/ai_places_intervention_20/ai_sanbernardino.jpg,AI,Mage,stimuli/AI/ai_faces_intervention_20/7.S.EA.M.png,AI,StyleGAN2,99.9,AI,multifeatured
,link ,AirBnb,"Muncie, IN",NA,Quaint carriage house.,"Youíll†think†you†are†in†the†country†when†you†arrive†at†our†peaceful†10†acre†property†right†in†Muncie.†Located†near†our†historic†home,†built†in†1848,†youíll†find†a†carriage†house†with†an†upstairs†apartment†with†everything†you†need†for†a†relaxing†and†comfortable†stay.†This†is†a†quaint,†rustic†cabin†like†space†with†private†outdoor†area.†You†are†only†five†to†10†minutes†from†BSU†and†IU†Ball†Hospital,†downtown,†Elm†Street†Brewing,†the†Childrenís†Museum,†walking†trails†and†most†restaurants.",Human,83,NA,NA,NA,stimuli/Human/human_places_intervention_20/human_muncie.jpg,Human,NA,stimuli/Human/human_faces_intervention_20/46.R.W.M.png,Human,NA,0,Human,multifeatured
TM,NA,NA,"Florence, SC","Create and describe in 75 words a unique vacation rental in Florence, SC with the title "" Hadley's Hideaway "" including a detail about the location.",Hadley's Hideaway,"
Situated in Florence's historic district, just three blocks from the Francis Marion University Performing Arts Center, this renovated 1940s cottage offers southern charm with modern comfort. The two-bedroom home features original hardwood floors, a screened-in porch with rocking chairs, and a bright, updated kitchen. The peaceful backyard garden provides a tranquil setting for morning coffee or evening relaxation. Walking distance to downtown restaurants, the Florence County Museum, and the weekly farmers market. Minutes from Florence Regional Airport and Interstate 95 access.",AI,81,Claude,Yes,"Create an image of the front view of the described vacation rental listing:†Situated in Florence's historic district, just three blocks from the Francis Marion University Performing Arts Center, this renovated 1940s cottage offers southern charm with modern comfort. The two-bedroom home features original hardwood floors, a screened-in porch with rocking chairs, and a bright, updated kitchen. The peaceful backyard garden provides a tranquil setting for morning coffee or evening relaxation. Walking distance to downtown restaurants, the Florence County Museum, and the weekly farmers market. Minutes from Florence Regional Airport and Interstate 95 access.",stimuli/AI/ai_places_intervention_20/ai_florence.jpg,AI,Gemini,stimuli/AI/ai_faces_intervention_20/38.S.B.F.png,AI,StyleGAN2,0,AI,multifeatured
,link ,AirBnb,"Concord, NH",NA,"Historic Colonial Downtown, Room #1","Enjoy†Downtown†Concord†without†breaking†the†bank!†Step†into†New†England†history†at†this†Colonial†built†in†1855,†while†still†enjoying†modern†amenities†and†the†comforts†of†home.†First†floor†of†the†house†is†owner-occupied†and†locked†off†from†guests.†The†second†floor†has†a†separate†entrance,†shared†bathroom,†storage,†and†three†locking†bedrooms†rented†individually.†This†listing,†Room†#1,†is†the†largest†room†and†includes†a†queen†bed,†desk,†closet,†mini-fridge,†microwave,†WiFi,†heat/AC,†TV,†and†more.",Human,78,NA,NA,NA,stimuli/Human/human_places_intervention_20/human_concord.jpg,Human,NA,stimuli/Human/human_faces_intervention_20/24.R.EA.F.png,Human,NA,1.7,Human,multifeatured
TM,NA,NA,"Daytona Beach, FL","Create and describe in 75 words a unique vacation rental in Daytona Beach, FL with the title "" Glorious Oceanfront Escape: 1BR Private Balcony "" including a detail about the location.",Glorious Oceanfront Escape: 1BR Private Balcony,"

Perched on the 12th floor of an exclusive beachfront complex, just steps from the Daytona Beach Pier and Boardwalk, this modern condo offers breathtaking ocean views from every room. The stylish one-bedroom unit features floor-to-ceiling windows, a fully equipped kitchen, and a private balcony perfect for watching sunrise over the Atlantic. Building amenities include two oceanfront pools and secured parking. Located minutes from Daytona International Speedway, Ocean Walk Shoppes, and popular beach restaurants. Direct beach access with complimentary chairs and umbrellas for guests.",AI,83,Claude,Yes,"Create an image of the front view of the described vacation rental listing:† Perched on the 12th floor of an exclusive beachfront complex, just steps from the Daytona Beach Pier and Boardwalk, this modern condo offers breathtaking ocean views from every room. The stylish one-bedroom unit features floor-to-ceiling windows, a fully equipped kitchen, and a private balcony perfect for watching sunrise over the Atlantic. Building amenities include two oceanfront pools and secured parking. Located minutes from Daytona International Speedway, Ocean Walk Shoppes, and popular beach restaurants. Direct beach access with complimentary chairs and umbrellas for guests.",stimuli/AI/ai_places_intervention_20/ai_daytonabeach.jpg,AI,Gemini,stimuli/AI/ai_faces_intervention_20/12.S.SA.F.png,AI,StyleGAN2,0.1,AI,multifeatured
,link ,AirBnb,"Billings, MT",NA,Industrial Loft@Old Pine Retreat,"Here is your opportunity to experience a remote getaway just minutes away from downtown Billings. This beautiful, vintage-industrial themed house has features that include a 21 foot high ceiling in the living room, a gas fireplace, a loft master bedroom and a second bedroom, large bathrooms on both levels and a private deck. If this isn't enough, the views and remote space that you will get to experience will be enough to take your breath away!",Human,76,NA,NA,NA,stimuli/Human/human_places_intervention_20/human_billings1.jpg,Human,NA,stimuli/Human/human_faces_intervention_20/33.R.EA.M.png,Human,NA,0,Human,multifeatured
TM,NA,NA,"Charleston, SC","Create and describe in 75 words a unique vacation rental in Charleston, SC with the title "" Stunning Couples Cottage with Creek Dock! "" including a detail about the location.",Stunning Couples Cottage with Creek Dock!,"
Positioned on tranquil Shem Creek in Mount Pleasant's coveted Old Village district, this enchanting 600-square-foot hideaway delivers waterfront peace just minutes from Charleston's historic center. The expertly updated cottage includes a personal dock ideal for paddling adventures and wildlife viewing, plus a breezy screened veranda overlooking the water. Situated moments from fresh seafood dining and the historic Pitt Street Bridge, this intimate escape merges coastal allure with contemporary comfort.",AI,78,Claude,Yes,"Create an image of the exterior view of the described vacation rental listing: ""Stunning Couples Cottage with Creek Dock!""

Positioned on tranquil Shem Creek in Mount Pleasant's coveted Old Village district, this enchanting 600-square-foot hideaway delivers waterfront peace just minutes from Charleston's historic center. The expertly updated cottage includes a personal dock ideal for paddling adventures and wildlife viewing, plus a breezy screened veranda overlooking the water. Situated moments from fresh seafood dining and the historic Pitt Street Bridge, this intimate escape merges coastal allure with contemporary comfort.",stimuli/AI/ai_places_intervention_20/ai_charleston1.jpg,AI,Gemini,stimuli/AI/ai_faces_intervention_20/35.S.B.F.png,AI,StyleGAN2,0,AI,multifeatured
,link ,AirBnb,"Rockford, IL",NA,Relaxing Riverside Stay w HotTub,"Welcome to our thoughtfully designed River Home on a safe, quiet, private drive on the highly desired Rock River. Get ready to enjoy indoor-outdoor living at its finest. This pet and family-friendly space features a 6-person hot tub, furnished riverfront deck, game room w/ pool and darts, fire pit, and an ensuite-covered second-floor patio. Although this home is secluded, you're only 10 minutes from Anderson Japanese Gardens, SportsCore 1, and multiple fine dining options in downtown Rockford.",Human,77,NA,NA,NA,stimuli/Human/human_places_intervention_20/human_rockford.jpg,Human,NA,stimuli/Human/human_faces_intervention_20/24.R.SA.F.png,Human,NA,0,Human,multifeatured
YF,NA,NA,"Appleton, WI","Create and describe in 75 words a unique vacation rental in Appleton, WI with the title ""Sweet Getaway"" including a detail about a nearest tourist attraction.",Sweet Getaway,"Located just a mile from the famous Hearthstone Historic House Museum, this charming craftsman bungalow offers a cozy retreat in Appleton's historic district. The two-bedroom home features a welcoming living room with a gas fireplace, updated kitchen with local coffee service, and a peaceful sunroom overlooking the garden. The covered back patio provides a perfect spot for enjoying Wisconsin's summer evenings. Easy walking distance to Lawrence University, the Fox River Trail, and downtown's diverse dining scene.",AI,61,Claude,No,"Create an image of the outside, external front view of the described vacation rental listing: ["" Sweet Getaway is a delightful two-story Victorian home situated just a 5-minute walk from the Fox Cities Performing Arts Center. This elegantly restored 1890s residence features period details, including ornate woodwork and stained glass windows. The cozy interior combines vintage charm with modern comfort, offering a gourmet kitchen, three bedrooms with plush bedding, and a wraparound porch perfect for morning coffee.""]",stimuli/AI/ai_places_intervention_20/ai_appleton.jpg,AI,Mage  (General Fast -- Stable Diffusion XL),stimuli/AI/ai_faces_intervention_20/45.S.B.M.png,AI,StyleGAN2,,AI,multifeatured
,link ,AirBnb,"La Crosse, WI",NA,Northshore Cottage (2 bedrooms) on Lake Onalaska,Come stay at our cozy and comfortable two bedroom cottage located in a quiet neighborhood with views and access to Lake Onalaska. Walk across the street to hiking/biking trails. Near the Great River State Bike Trail. The Lake Onalaska canoe/kayak trail goes past our shoreline. Two sit on top kayaks and two easy ride bicycles are included. There are fishing boat rentals nearby or you can fish from the shore while enjoying Lake Onalaska's famous sunsets. No cleaning fee!,Human,79,NA,NA,NA,stimuli/Human/human_places_intervention_20/human_lacrosse.jpg,Human,NA,stimuli/Human/human_faces_intervention_20/41.R.EA.M.png,Human,NA,,Human,multifeatured
YF,NA,NA,"Vincennes, IN","Create and describe in 75 words a unique vacation rental in Vincennes, IN with the title ""Cozy Two Bedroom Home"" including a detail about a nearest tourist attraction.",Cozy Two Bedroom Home,"Located just five minutes from the historic George Rogers Clark National Historical Park, this charming brick home offers a comfortable stay in Indiana's oldest city. The newly updated property features a welcoming living room with original hardwood floors, a fully equipped kitchen, and a covered front porch perfect for morning coffee. Period details blend seamlessly with modern conveniences throughout this historic district gem. Guests can easily walk to Vincennes University campus, the Indiana Military Museum, and downtown's vibrant restaurant scene.

",AI,80,Claude,No,"Create an image of the front view of the described vacation rental listing: Located just five minutes from the historic George Rogers Clark National Historical Park, this charming brick home offers a comfortable stay in Indiana's oldest city. The newly updated property features a welcoming living room with original hardwood floors, a fully equipped kitchen, and a covered front porch perfect for morning coffee. Period details blend seamlessly with modern conveniences throughout this historic district gem. Guests can easily walk to Vincennes University campus, the Indiana Military Museum, and downtown's vibrant restaurant scene.

",stimuli/AI/ai_places_intervention_20/ai_vincennes.jpg,AI,Mage  (General Fast -- Stable Diffusion XL),stimuli/AI/ai_faces_intervention_20/42.S.EA.M.png,AI,StyleGAN2,,AI,multifeatured
,link ,AirBnb,"Twin Falls, ID",NA,"Deluxe Retreat! Hot tub, sauna, and canyon views!","This†beautifully†remodeled†duplex†is†situated†on†1.5†acres†at†the†edge†of†Rock†Creek†Canyon.†Enjoy†spanning†countryside†and†canyon†views†while†being†only†7†mins†away†from†Twin†Fallsí†wide†variety†of†shopping†and†restaurants.†Kick†back,†relax†and†take†in†the†views†from†the†hot†tub†or†sauna.†Come†stay†in†style†and†enjoy†all†the†adventures†in†Twin†Falls.",Human,63,NA,NA,NA,stimuli/Human/human_places_intervention_20/human_twinfalls.jpg,Human,NA,stimuli/Human/human_faces_intervention_20/9.R.W.F.png,Human,NA,,Human,multifeatured
YF,NA,NA,"Watertown, SD","Create and describe in 75 words a unique vacation rental in Watertown, SD with the title ""Mayfair Drive"" including a detail about amenities.",Mayfair Drive,"Experience South Dakota charm in this completely renovated 1950s ranch home, situated in Watertown's peaceful east side neighborhood. This three-bedroom retreat features mid-century modern furnishings and an open-concept living space perfect for family gatherings. The gourmet kitchen boasts stainless steel appliances and a coffee bar with local roasts. Amenities include smart home features, high-speed fiber internet, and a spacious backyard patio with a gas grill and fire pit for evening entertainment and stargazing. Just minutes from Lake Kampeska and downtown shopping.",AI,81,Claude,No,"Create an image of the front view of the described vacation rental listing: Experience South Dakota charm in this completely renovated 1950s ranch home, situated in Watertown's peaceful east side neighborhood. This three-bedroom retreat features mid-century modern furnishings and an open-concept living space perfect for family gatherings. The gourmet kitchen boasts stainless steel appliances and a coffee bar with local roasts. Amenities include smart home features, high-speed fiber internet, and a spacious backyard patio with a gas grill and fire pit for evening entertainment and stargazing. Just minutes from Lake Kampeska and downtown shopping.",stimuli/AI/ai_places_intervention_20/stimuli/AI/ai_places_intervention_20/ai_watertown1.jpg,AI,Mage  (General Fast -- Stable Diffusion XL),stimuli/AI/ai_faces_intervention_20/1.S.B.M.png,AI,StyleGAN2,,AI,multifeatured
,link ,AirBnb,"Bentonville, AR",NA,The Overlook,"Prime location in downtown Bentonville and hosts that are clean freaks! You will be extra comfortable in our stylish space with huge windows and sleek modern interior. Hop on the bike trails, walk to the museums and stroll to all the downtown bars and restaurants. Two single speed cruiser bikes with locks are included with your stay.  With our hands-on approach to guest satisfaction and extra touches, your comfort is our top priority.",Human,73,NA,NA,NA,stimuli/Human/human_places_intervention_20/human_bentonville.jpg,Human,NA,stimuli/Human/human_faces_intervention_20/16.R.SA.F.png,Human,NA,,Human,multifeatured
YF,NA,NA,"Jackson, WY","Create and describe in 75 words a unique vacation rental in Jackson, WY with the title ""Cozy Mountain Escape in Jackson"" including a detail about the location.",Cozy Mountain Escape in Jackson,"Nestled in the heart of Jackson's historic district, just three blocks from Town Square and its iconic antler arches, this renovated log cabin offers authentic Wyoming charm. The one-bedroom retreat features panoramic Teton views, a stone fireplace, and rustic-modern decor. After a day of skiing at Jackson Hole Resort (15 minutes away), unwind in the private outdoor hot tub. The property includes a fully equipped gourmet kitchen, complimentary snowshoes, and easy access to local hiking trails and the National Elk Refuge.
",AI,81,Claude,No,"Create an image of the exterior front view of the described vacation rental listing: ["" Cozy Mountain Escape in Jackson is perfectly situated just 10 minutes from Jackson Hole Mountain Resort and five minutes from the historic Town Square. This charming mountain retreat offers breathtaking views of the Teton Range from its wraparound deck. The interior features rustic-luxe design with reclaimed timber accents, while large picture windows frame the surrounding mountain landscape and abundant wildlife.""]",stimuli/AI/ai_places_intervention_20/ai_jackson2.jpg,AI,Gemini (2.0 Flash),stimuli/AI/ai_faces_intervention_20/8.S.B.M.png,AI,StyleGAN2,,AI,multifeatured
,link ,AirBnb,"Glens Falls, NY",NA,The Dax,"Nestled along the foothills of the gorgeous Adirondack mountains, you will find this unique & modern gambrel-style cabin the perfect getaway. With modern amenities along with plenty of extras, you can be as busy or as low-key as you would like. You will find locally-sourced items with intentional & personalized touches throughout the space to ensure your stay will feel like home. Located at an equal distance of 25 minutes to both Saratoga Springs, NY & Lake George, NY ...adventure awaits!",Human,78,NA,NA,NA,stimuli/Human/human_places_intervention_20/human_glenfalls.jpg,Human,NA,stimuli/Human/human_faces_intervention_20/42.R.EA.F.png,Human,NA,,Human,multifeatured
YF,NA,NA,"Richmond, IN","Create and describe in 75 words a unique vacation rental in Richmond, IN with the title ""The Cottage on Abington Pike - Earlham College"" including a detail about amenities.",The Cottage on Abington Pike - Earlham College,"This charming 1920s craftsman cottage sits just minutes from Earlham College's campus, offering a peaceful retreat for visiting families and faculty. The newly renovated 2-bedroom home features original hardwood floors, a wraparound porch perfect for morning coffee, and a cozy gas fireplace. Modern amenities include a fully equipped smart kitchen with a Nespresso machine, high-speed WiFi, and a dedicated workspace. The fenced backyard provides a serene garden setting with a charming pergola and herb garden.",AI,65,Claude,No,"Create an image of the exterior front view of the described vacation rental listing: ["" The Cottage on Abington Pike - Earlham College is a charming renovated farmhouse just minutes from campus. This cozy retreat features modern amenities including a fully-equipped kitchen with Keurig coffee station, high-speed fiber internet, and smart home technology throughout. The comfortable living space offers a 55"" smart TV with streaming services, while the peaceful screened porch overlooks a private garden with bird feeders and native plantings. ""]",stimuli/AI/ai_places_intervention_20/ai_richmond.jpg,AI,Gemini (2.0 Flash),stimuli/AI/ai_faces_intervention_20/23.S.W.M.png,AI,StyleGAN2,,AI,multifeatured